{
  "meta": {
    "schema_version": "1.1.0",
    "title": "上海房产网签成交数据（二手房 / 一手房）",
    "data_as_of": "2026-10-30",
    "timezone": "Asia/Shanghai",
    "metric_definition": {
      "units": "当日/当月网上房地产（fangdi）网签成交套数。二手房与一手房口径不同，不可直接合并比较。",
      "area_m2": "网签成交建筑面积，单位 ㎡。tllandy 来源无此字段。",
      "area_quality": "approximate = 上游给的是万位取整的约数；exact = 精确到分。"
    },
    "kinds": {
      "observed": "由逐日明细求和得到，含面积与实测天数。",
      "reference": "第三方月度锚点，仅有月度总量，不含面积与日度信息。"
    },
    "sources": [
      {"id": "fangdi_official", "name": "网上房地产官网直采（www.fangdi.com.cn）", "url": "https://www.fangdi.com.cn/", "license": "官网公开数据，未见再分发许可；本仓库仅作引用，请遵守站点条款", "granularity": "daily", "metrics": ["units", "area_m2"], "role": "primary", "acquire_method": "headless_chrome_dump", "notes": "唯一的每日直采主源，也是 ahbencat 的同一上游。全站 HTML 挂瑞数动态防护（裸 HTTP 一律 412），必须用真实浏览器执行挑战脚本后才能取到内容，因此采集器用系统 Chrome 的 headless dump，并把渲染后 DOM 原文归档。一手房计数器当日不采则永久丢失，二手房只提供「昨日」单点，两个市场都无法回溯补采 —— 历史只能靠 fallback 源。"},
      {"id": "ahbencat", "name": "ahbencat/shanghai_fangdi_data", "url": "https://github.com/ahbencat/shanghai_fangdi_data", "license": "未声明", "granularity": "daily", "metrics": ["units", "area_m2"], "role": "fallback", "acquire_method": "http_get", "notes": "备用源。官网直采失败或历史上未直采的日期由此补齐。经逐日核对，其二手房数值与官网「昨日成交量」完全相等（2026-10-29 双方均为 801 套 / 63,604.46 ㎡），一手房为其每日 22:30 采得的计数器快照，与官网 17:00 的 trade 页数值差值等于两时点之间的签约增量。同为 fangdi 口径，故与官网同日必须逐值相等，可作为解析错误检测，但不构成对上游数据本身的独立验证。"},
      {"id": "tllandy", "name": "tllandy/Shanghai-Property-Market-Calendar", "url": "https://github.com/tllandy/Shanghai-Property-Market-Calendar", "license": "未声明", "granularity": "daily", "metrics": ["units"], "role": "historical", "acquire_method": "manual_download", "notes": "仓库未注明上游。2025-06/07/08 月汇总与开源证券锚点一致（偏差 <= 1 套）。注意：一致说明二者很可能同源，不构成独立验证。无面积字段。仓库已停更，数据冻结。"},
      {"id": "soschina_wind", "name": "开源证券研究所（Wind 数据）上海月度网签", "url": "https://www.sdyanbao.com/preview/981393", "license": "研究报告引用，非再分发许可", "granularity": "monthly", "metrics": ["units"], "role": "historical", "acquire_method": "manual_transcription", "notes": "第三方月度锚点，无日度、无面积。与 ahbencat 重叠的 11 个月份数值全部完全相等，判定同源，仅用于填补无日度月份的月度总量，不构成独立校验。人工誊录自研报图表，非机器抓取，无可复现的原始文件。"},
      {"id": "jozhn", "name": "jozhn/shanghai-house-data-view 月度对比", "url": "https://github.com/jozhn/shanghai-house-data-view", "license": "未声明", "granularity": "monthly", "metrics": ["units", "area_wan_m2", "amount_yi"], "role": "historical", "acquire_method": "manual_transcription", "notes": "该仓库是可视化层，其底层每日数据仓 jozhn/shanghai-house-data 已 404。2026-07/08/09 三个月套数与 ahbencat 完全相等，判定同源，不构成独立校验；仅成交金额（亿元）与由此推导的均价是本项目其他来源没有的维度。"}
    ]
  },
  "markets": {
    "second_hand": {
      "label": "二手房",
      "daily": [
        {"date": "2025-06-01", "units": 252, "area_m2": null, "area_quality": null, "provenance": {"kind": "observed", "source_ids": ["tllandy"], "method": "daily_xlsx"}},
        {"date": "2025-06-02", "units": 347, "area_m2": null, "area_quality": null, "provenance": {"kind": "observed", "source_ids": ["tllandy"], "method": "daily_xlsx"}},
        {"date": "2025-06-03", "units": 682, "area_m2": null, "area_quality": null, "provenance": {"kind": "observed", "source_ids": ["tllandy"], "method": "daily_xlsx"}},
        {"date": "2025-06-04", "units": 643, "area_m2": null, "area_quality": null, "provenance": {"kind": "observed", "source_ids": ["tllandy"], "method": "daily_xlsx"}},
        {"date": "2025-06-05", "units": 724, "area_m2": null, "area_quality": null, "provenance": {"kind": "observed", "source_ids": ["tllandy"], "method": "daily_xlsx"}},
        {"date": "2025-06-06", "units": 694, "area_m2": null, "area_quality": null, "provenance": {"kind": "observed", "source_ids": ["tllandy"], "method": "daily_xlsx"}},
        {"date": "2025-06-07", "units": 1155, "area_m2": null, "area_quality": null, "provenance": {"kind": "observed", "source_ids": ["tllandy"], "method": "daily_xlsx"}},
        {"date": "2025-06-08", "units": 933, "area_m2": null, "area_quality": null, "provenance": {"kind": "observed", "source_ids": ["tllandy"], "method": "daily_xlsx"}},
        {"date": "2025-06-09", "units": 550, "area_m2": null, "area_quality": null, "provenance": {"kind": "observed", "source_ids": ["tllandy"], "method": "daily_xlsx"}},
        {"date": "2025-06-10", "units": 584, "area_m2": null, "area_quality": null, "provenance": {"kind": "observed", "source_ids": ["tllandy"], "method": "daily_xlsx"}},
        {"date": "2025-06-11", "units": 531, "area_m2": null, "area_quality": null, "provenance": {"kind": "observed", "source_ids": ["tllandy"], "method": "daily_xlsx"}},
        {"date": "2025-06-12", "units": 606, "area_m2": null, "area_quality": null, "provenance": {"kind": "observed", "source_ids": ["tllandy"], "method": "daily_xlsx"}},
        {"date": "2025-06-13", "units": 626, "area_m2": null, "area_quality": null, "provenance": {"kind": "observed", "source_ids": ["tllandy"], "method": "daily_xlsx"}},
        {"date": "2025-06-14", "units": 1059, "area_m2": null, "area_quality": null, "provenance": {"kind": "observed", "source_ids": ["tllandy"], "method": "daily_xlsx"}},
        {"date": "2025-06-15", "units": 892, "area_m2": null, "area_quality": null, "provenance": {"kind": "observed", "source_ids": ["tllandy"], "method": "daily_xlsx"}},
        {"date": "2025-06-16", "units": 550, "area_m2": null, "area_quality": null, "provenance": {"kind": "observed", "source_ids": ["tllandy"], "method": "daily_xlsx"}},
        {"date": "2025-06-17", "units": 520, "area_m2": null, "area_quality": null, "provenance": {"kind": "observed", "source_ids": ["tllandy"], "method": "daily_xlsx"}},
        {"date": "2025-06-18", "units": 676, "area_m2": null, "area_quality": null, "provenance": {"kind": "observed", "source_ids": ["tllandy"], "method": "daily_xlsx"}},
        {"date": "2025-06-19", "units": 589, "area_m2": null, "area_quality": null, "provenance": {"kind": "observed", "source_ids": ["tllandy"], "method": "daily_xlsx"}},
        {"date": "2025-06-20", "units": 603, "area_m2": null, "area_quality": null, "provenance": {"kind": "observed", "source_ids": ["tllandy"], "method": "daily_xlsx"}},
        {"date": "2025-06-21", "units": 1031, "area_m2": null, "area_quality": null, "provenance": {"kind": "observed", "source_ids": ["tllandy"], "method": "daily_xlsx"}},
        {"date": "2025-06-22", "units": 924, "area_m2": null, "area_quality": null, "provenance": {"kind": "observed", "source_ids": ["tllandy"], "method": "daily_xlsx"}},
        {"date": "2025-06-23", "units": 497, "area_m2": null, "area_quality": null, "provenance": {"kind": "observed", "source_ids": ["tllandy"], "method": "daily_xlsx"}},
        {"date": "2025-06-24", "units": 517, "area_m2": null, "area_quality": null, "provenance": {"kind": "observed", "source_ids": ["tllandy"], "method": "daily_xlsx"}},
        {"date": "2025-06-25", "units": 551, "area_m2": null, "area_quality": null, "provenance": {"kind": "observed", "source_ids": ["tllandy"], "method": "daily_xlsx"}},
        {"date": "2025-06-26", "units": 605, "area_m2": null, "area_quality": null, "provenance": {"kind": "observed", "source_ids": ["tllandy"], "method": "daily_xlsx"}},
        {"date": "2025-06-27", "units": 578, "area_m2": null, "area_quality": null, "provenance": {"kind": "observed", "source_ids": ["tllandy"], "method": "daily_xlsx"}},
        {"date": "2025-06-28", "units": 1093, "area_m2": null, "area_quality": null, "provenance": {"kind": "observed", "source_ids": ["tllandy"], "method": "daily_xlsx"}},
        {"date": "2025-06-29", "units": 1014, "area_m2": null, "area_quality": null, "provenance": {"kind": "observed", "source_ids": ["tllandy"], "method": "daily_xlsx"}},
        {"date": "2025-06-30", "units": 748, "area_m2": null, "area_quality": null, "provenance": {"kind": "observed", "source_ids": ["tllandy"], "method": "daily_xlsx"}},
        {"date": "2025-07-01", "units": 514, "area_m2": null, "area_quality": null, "provenance": {"kind": "observed", "source_ids": ["tllandy"], "method": "daily_xlsx"}},
        {"date": "2025-07-02", "units": 524, "area_m2": null, "area_quality": null, "provenance": {"kind": "observed", "source_ids": ["tllandy"], "method": "daily_xlsx"}},
        {"date": "2025-07-03", "units": 477, "area_m2": null, "area_quality": null, "provenance": {"kind": "observed", "source_ids": ["tllandy"], "method": "daily_xlsx"}},
        {"date": "2025-07-04", "units": 525, "area_m2": null, "area_quality": null, "provenance": {"kind": "observed", "source_ids": ["tllandy"], "method": "daily_xlsx"}},
        {"date": "2025-07-05", "units": 819, "area_m2": null, "area_quality": null, "provenance": {"kind": "observed", "source_ids": ["tllandy"], "method": "daily_xlsx"}},
        {"date": "2025-07-06", "units": 753, "area_m2": null, "area_quality": null, "provenance": {"kind": "observed", "source_ids": ["tllandy"], "method": "daily_xlsx"}},
        {"date": "2025-07-07", "units": 492, "area_m2": null, "area_quality": null, "provenance": {"kind": "observed", "source_ids": ["tllandy"], "method": "daily_xlsx"}},
        {"date": "2025-07-08", "units": 512, "area_m2": null, "area_quality": null, "provenance": {"kind": "observed", "source_ids": ["tllandy"], "method": "daily_xlsx"}},
        {"date": "2025-07-09", "units": 521, "area_m2": null, "area_quality": null, "provenance": {"kind": "observed", "source_ids": ["tllandy"], "method": "daily_xlsx"}},
        {"date": "2025-07-10", "units": 565, "area_m2": null, "area_quality": null, "provenance": {"kind": "observed", "source_ids": ["tllandy"], "method": "daily_xlsx"}},
        {"date": "2025-07-11", "units": 539, "area_m2": null, "area_quality": null, "provenance": {"kind": "observed", "source_ids": ["tllandy"], "method": "daily_xlsx"}},
        {"date": "2025-07-12", "units": 911, "area_m2": null, "area_quality": null, "provenance": {"kind": "observed", "source_ids": ["tllandy"], "method": "daily_xlsx"}},